CatID,CatName,CatPersonal,Cat
C0032,Burmilla,"""ความเงางามแห่งเงิน"" เป็นส่วนผสมที่ลงตัวระหว่างแมวเบอร์มีสและเปอร์เซียชินชิลล่า ทำให้ได้แมวที่มีรูปร่างดีและมีขนสีเงินประกาย สวยงามเหมือนใส่เครื่องประดับ",เกิดขึ้นโดยความบังเอิญในอังกฤษปี 1981 เมื่อแมวสองสายพันธุ์แอบผสมพันธุ์กันเองในบ้านหลังหนึ่ง ผลออกมาเป็นลูกแมวที่สวยจนเจ้าของตัดสินใจทำเป็นสายพันธุ์ใหม่
C0033,Peterbald,"""นายแบบหุ่นเพรียว"" เป็นแมวไร้ขนที่มีรูปร่างสง่างามแบบตะวันออก (หน้าแหลม หูใหญ่ ตัวยาว) ผิวหนังมีสัมผัสเหมือนยางลบหรือกำมะหยี่ ความเจ๋งคือเขามี ""พังผืด"" ที่นิ้วเท้าทำให้หยิบจับของได้เก่งเหมือนมือคน",พัฒนาขึ้นในเมืองเซนต์ปีเตอร์สเบิร์ก ประเทศรัสเซีย เมื่อปี 1994 โดยการผสมข้ามสายพันธุ์ระหว่างแมวพันธุ์ Don Sphynx กับ Oriental Shorthair
C0034,LaPerm,"""แมวหัวฟู"" มีขนหยิกเป็นลอนคล้ายโดนดัดดิจิทัลมาทั้งตัว ขนจะมีความนุ่มและยืดหยุ่นสูงมาก นิสัยขี้อ้อนสุดๆ ชอบเอาหน้ามาซุกและส่งเสียงคราง (Purr) ดังกว่าแมวทั่วไป","เกิดจากการกลายพันธุ์ตามธรรมชาติในฟาร์มที่รัฐโอเรกอน สหรัฐอเมริกา เมื่อปี 1982 โดยลูกแมวตัวหนึ่งเกิดมา ""หัวล้าน"" แต่พอโตขึ้นกลับมีขนหยิกพริ้วสวยงามออกมาแทน"
C0035,Ocicat,"""เสือดาวจำลอง"" เป็นแมวที่มีลายจุดเหมือนแมวป่าแบบ 100% แต่ไม่มีสายเลือดสัตว์ป่าผสมอยู่เลย ร่างกายบึกบึน แข็งแรง และที่สำคัญคือ ""ฝึกง่ายเหมือนหมา"" สามารถใส่สายจูงเดินเล่นได้",เกิดจากความบังเอิญในการผสมพันธุ์ระหว่างแมว Abyssinian และ Siamese ในช่วงปี 1964 เพื่อพยายามสร้างแมวแต้มลายใหม่ แต่ดันได้ลูกแมวลายจุดทองอร่ามออกมาแทน
C0036,Donskoy,"""เอเลี่ยนผู้ใจดี"" เป็นแมวไร้ขนจากรัสเซียที่ต่างจาก Sphynx ตรงที่ยีนไร้ขนของมันเป็น ""ยีนเด่น"" ผิวหนังยับย่นมากและอุ่นจัด นิสัยเป็นมิตรอย่างเหลือเชื่อ เข้ากับคนแปลกหน้าได้ทันที",ถูกพบครั้งแรกในปี 1987 ที่เมือง Rostov-on-Don ประเทศรัสเซีย โดยหญิงคนหนึ่งช่วยลูกแมวที่โดนทำร้ายมา แล้วพบว่าพอมันโตขึ้นขนก็ร่วงจนหมดเกลี้ยง
C0037,Havana Brown,"""ช็อกโกแลตเดินได้"" เป็นแมวสายพันธุ์เดียวในโลกที่มีสีน้ำตาลช็อกโกแลตเข้มทั่วทั้งตัว รวมถึงหนวดก็เป็นสีน้ำตาล! มีดวงตาสีเขียวมรกตที่ตัดกับสีขนอย่างสวยงาม","ถูกพัฒนาขึ้นในอังกฤษช่วงปี 1950 โดยนักผสมพันธุ์ที่หลงใหลในแมวสีน้ำตาลล้วน ชื่อ ""Havana"" มาจากสีของซิการ์ฮาวานาที่มีสีน้ำตาลโทนเดียวกัน"
C0038,Snowshoe,"""หน้ากากขาวเท้าปุย"" รูปร่างหน้าตาเหมือนแมววิเชียรมาศ แต่มีจุดต่างคือมี ""ถุงเท้าสีขาว"" ทั้ง 4 ข้าง และมีแถบสีขาวรูปตัว V คว่ำบนใบหน้า นิสัยช่างพูดและชอบเล่นน้ำมาก",พัฒนาขึ้นในฟิลาเดลเฟียช่วงปี 1960 เมื่อแมววิเชียรมาศตัวหนึ่งให้กำเนิดลูกแมวที่มีเท้าสีขาว 3 ตัว นักบรีดจึงนำลักษณะนี้มาพัฒนาจนกลายเป็นสายพันธุ์ใหม่
C0039,Manx,"""แมวไม่มีหาง"" (หรือหางสั้นกุดเป็นปุ่ม) ขาหลังยาวกว่าขาหน้าทำให้เวลาเดินหรือวิ่งจะดูเหมือนกระต่ายกระโดด นิสัยเหมือนสุนัข ชอบขุดดินและคาบของ",เป็นแมวพื้นเมืองบนเกาะแมน (Isle of Man) ในทะเลไอริช เกิดจากการกลายพันธุ์ทางพันธุกรรมที่จำกัดอยู่ในพื้นที่เกาะจนกลายเป็นลักษณะประจำสายพันธุ์ มีตำนานเล่าตลกๆ ว่ามันขึ้นเรือโนอาห์ไม่ทันจนโดนประตูหนีบหางขาด
C0040,Nebelung,"""แมวในม่านหมอก"" มีรูปร่างหน้าตาเหมือน Russian Blue แต่เป็นเวอร์ชันขนยาวสลวยสีเทาเงิน ตาสีเขียวสดใส นิสัยสุภาพ ขี้อาย และรักความสงบมาก","ชื่อ Nebelung มาจากภาษาเยอรมันที่แปลว่า ""สิ่งมีชีวิตในสายหมอก"" พัฒนาขึ้นในอเมริกาช่วงปี 1980 โดยนักผสมพันธุ์ต้องการสร้างแมวที่ดูลึกลับเหมือนแมวในยุควิกตอเรีย"
C0041,Pixie-Bob,"""แมวป่าจำลอง"" หน้าตาดูดุดันเหมือนแมวป่าบ็อบแคต (Bobcat) มีหางสั้นและมีขนที่ปลายหู และที่พิเศษคือเป็นสายพันธุ์ที่อนุญาตให้มี ""นิ้วเกิน"" (Polydactyl) ได้ (มีนิ้วเท้าได้ถึง 7 นิ้วต่อข้าง)",เริ่มต้นจากแมวในวอชิงตันช่วงปี 1980 ที่มีลักษณะเหมือนแมวป่ามากจนคนเชื่อว่าเป็นลูกผสม (แต่ผลตรวจ DNA พบว่าเป็นแมวบ้านที่มีลักษณะเด่นเฉยๆ)
C0042,Burmilla,"""ประกายสีเงิน"" เป็นแมวที่มีขนสองชั้นสีขาวเงิน แต่ที่ปลายขนจะมีสีเข้มแต้มอยู่ (Tipping) ทำให้เวลาขยับตัวจะดูเหมือนมีแสงระยิบระยับ นิสัยขี้เล่นแต่ไม่ซนจนเกินไป",เกิดจากความรักโดยบังเอิญในอังกฤษปี 1981 ระหว่างแมวเบอร์มีสสีม่วงอ่อนกับแมวเปอร์เซียสีเงินที่รอการผสมพันธุ์ แต่แอบมาเจอกันก่อนจนได้ลูกออกมาสวยสะดุดตา
C0043,Balinese,"""วิเชียรมาศขนยาว"" มีลักษณะสีแต้มและตาสีฟ้าเหมือนแมวไทยวิเชียรมาศทุกประการ แต่ขนยาวนุ่มสลวยและหางเป็นพวงสวยงาม สง่างามเหมือนนักเต้นระบำบาหลี",ไม่ได้มาจากเกาะบาหลี แต่พัฒนาในอเมริกาจากการคัดเลือกแมววิเชียรมาศที่มีการกลายพันธุ์ขนยาว (Recessive Gene) มาผสมพันธุ์ต่อ
C0044,Serengeti,"""ขาเรียวยาวหูใหญ่โต"" เป็นแมวที่ตั้งใจเลียนแบบรูปลักษณ์ของแมวป่าเซอร์วัล (Serval) แต่ไม่มีเลือดแมวป่าเลย (ต่างจากซาวันนาห์) นิสัยบ้าพลัง ชอบวิ่งกระโดด และชอบส่งเสียงคุย",เกิดจากการผสมข้ามสายพันธุ์ระหว่างแมวเบงกอลและแมวโอเรียนทัล เพื่อให้ได้แมวที่มีลุคแมวป่าแอฟริกาแต่มีนิสัยเชื่องและเลี้ยงง่ายแบบแมวบ้าน 100%